[
  {
    "id": "PRR-04",
    "kind": "redaction",
    "status": "withheld",
    "tag": "open",
    "title": "The project's cost-benefit analysis is withheld",
    "detail": "Item 4 of the BOSC public-records request — the projected tax-revenue impact and public-ROI inputs and assumptions — is held by county legal counsel under R.C. 149.43 and the §9.66(D) data-center exemption. Not produced.",
    "source": "Allen County PRR · item 4",
    "issue": null,
    "note": "the one to watch"
  },
  {
    "id": "PTI-313MW",
    "kind": "redaction",
    "status": "withheld",
    "tag": "open",
    "title": "The per-engine output behind the 313 MW figure is trade-secret-redacted",
    "detail": "The final air permit-to-install (eDoc 4132514, 2026-05-28) confirms the generator count and three-hall emission-unit grouping on a primary footing, but the per-engine ekW behind the disclosed 313 MW is redacted as trade secret.",
    "source": "OEPA PTI · eDoc 4132514",
    "issue": null,
    "note": null
  },
  {
    "id": "ASWCD-PLANS",
    "kind": "redaction",
    "status": "withheld",
    "tag": "open",
    "title": "The site plan sets are withheld twice over",
    "detail": "The County withholds the BOSC-1A plan sets; the Soil & Water district shields the same documents again under R.C. 149.433 (infrastructure records) and R.C. 1333.61 (trade secret — “water and wastewater usage for a data center”), a ground that reaches even the plan-share links inside produced emails.",
    "source": "Allen SWCD · §149.433 / §1333.61",
    "issue": null,
    "note": null
  },
  {
    "id": "PRR-16",
    "kind": "redaction",
    "status": "withheld",
    "tag": "open",
    "title": "The county website's edit history is disclaimed, not absent",
    "detail": "Item 16 (the CMS audit trail for the Sanitary Engineering pages) was answered “no records — we don't manage the website,” yet the WordPress /revisions endpoint returns HTTP 401 (gated, not 404). The version history exists; custody sits with the host.",
    "source": "Allen County PRR · item 16 · contested",
    "issue": null,
    "note": null
  },
  {
    "id": "ASWCD-03",
    "kind": "question",
    "status": "review",
    "tag": "open",
    "title": "Wetland determination: “no records” — but a produced inspection says otherwise",
    "detail": "The SWCD answered “no records” for the 0.7-acre forested wetland (DSW401251760W), yet a produced site inspection records that “the existing wetland was mitigated.” A produced record contradicts the answer.",
    "source": "Allen SWCD · item 3",
    "issue": null,
    "note": null
  },
  {
    "id": "ASWCD-04",
    "kind": "question",
    "status": "review",
    "tag": "open",
    "title": "Farm-tile drainage impact: “no records” — yet a failure is photographed",
    "detail": "The SWCD answered “no records” on tile / agricultural-drainage impact, but the 2026-06-05 inspection documents an east farm-tile diversion-swale failure (photo captioned “East farm tile bypass”).",
    "source": "Allen SWCD · item 4",
    "issue": null,
    "note": null
  },
  {
    "id": "FORCEMAIN-MGD",
    "kind": "question",
    "status": "unanswered",
    "tag": "open",
    "title": "Nobody owns the forcemain's MGD design capacity",
    "detail": "The Hume / Shawnee forcemain's design capacity (item 9) is disclaimed by every county body — each points to Ohio EPA or the townships. Batch 2 produced the financing and the engineering contract, not the MGD figure.",
    "source": "Cross-production referral · item 9",
    "issue": null,
    "note": null
  },
  {
    "id": "CORRIDOR-NPDES",
    "kind": "signal",
    "status": "low",
    "tag": "open",
    "title": "The corridor environmental permits are owned by no county body",
    "detail": "The NPDES construction-stormwater / SWPPP / ESC records for the forcemain corridors and Shawnee II Phase 2 sit with no county custodian — each “no records” answer refers onward to Ohio EPA or the townships, who were not yet a requested custodian.",
    "source": "Cross-production referral map",
    "issue": 151,
    "note": null
  },
  {
    "id": "PRR-02",
    "kind": "question",
    "status": "unanswered",
    "tag": "open",
    "title": "County ⇄ DoD / federal-contractor comms — narrowed to nothing",
    "detail": "Item 2 sought County communications with DoD or federal contractors (GDIT, GDLS) about the American Township facility and corridor. The county narrowed the ask and returned “no records.”",
    "source": "Allen County PRR · item 2 · narrowed",
    "issue": null,
    "note": null
  },
  {
    "id": "PRR-19",
    "kind": "question",
    "status": "unanswered",
    "tag": "open",
    "title": "County ⇄ engineer-of-record (EMH&T) comms not produced",
    "detail": "Item 19 sought County communications with EMH&T. None produced as to the Commissioners; the SWCD produced its own EMH&T emails, but the County's are still owed (it may supplement from Sanitary Engineering).",
    "source": "Allen County PRR · item 19 · owed",
    "issue": null,
    "note": null
  },
  {
    "id": "GLRI-INSTRUMENT",
    "kind": "question",
    "status": "unanswered",
    "tag": "open",
    "title": "The grant instrument behind the $650k Lost Creek project",
    "detail": "The funding source is verified — a GLRI subaward through Ohio EPA, OSU portion $327,450, term 2023–2025 — but the signed award instrument (deliverables, match, reporting) on the Maumee-headwater ag-runoff project is still owed.",
    "source": "Ohio EPA GLRI subaward files · owed",
    "issue": null,
    "note": null
  },
  {
    "id": "OSU-MONITORING",
    "kind": "signal",
    "status": "low",
    "tag": "open",
    "title": "The OSU monitoring data quantifying the Maumee-headwater load",
    "detail": "Continuous flow and water-quality from three ISCO6712 sites would quantify the actual nutrient / flow reduction on Lost Creek (HUC12 041000070305). The load-reduction table is referenced on the captured SWCD page but not transcribed.",
    "source": "Allen SWCD capture · untranscribed",
    "issue": null,
    "note": null
  },
  {
    "id": "H2-AUTH",
    "kind": "question",
    "status": "unanswered",
    "tag": "inference",
    "title": "The campus's federal authorization posture is undisclosed",
    "detail": "The Joint Systems Manufacturing Center (Lima Army Tank Plant) is co-located with the campus — documented geography under hypothesis H2 — but the campus's authorization posture (FedRAMP / DoD impact level) is undisclosed, so the causal link to the boom remains an inference.",
    "source": "Hypothesis H2 · defense nexus",
    "issue": null,
    "note": null
  },
  {
    "id": "H1-DRAW",
    "kind": "claim",
    "status": "low",
    "tag": "inference",
    "title": "The consumptive cooling draw against the river's cited 7Q10",
    "detail": "The Ottawa's design low flow is about 0.2 cfs (cited); the campus's consumptive cooling loss is the keystone of hypothesis H1. The measured draw against that 7Q10 is predicted evidence the record still needs to close end to end.",
    "source": "Hypothesis H1 · water & power",
    "issue": null,
    "note": null
  }
]
